{
  "id": "duelist_track",
  "name": "Laufbahn des Duellanten",
  "class": "duelist",
  "max_level": 5,
  "levels": [
    {
      "level": 1,
      "xp_required": 0
    },
    {
      "level": 2,
      "xp_required": 40,
      "unlock_skills": ["quick_feint"]
    },
    {
      "level": 3,
      "xp_required": 100,
      "stat_bonus": {
        "speed": 1
      }
    },
    {
      "level": 4,
      "xp_required": 220,
      "stat_bonus": {
        "hp": 3,
        "stamina": 2
      }
    },
    {
      "level": 5,
      "xp_required": 400,
      "stat_bonus": {
        "attack": 1,
        "speed": 1
      }
    }
  ],
  "description": "Präzisions-Laufbahn: früh Finten, danach Tempo und Angriffskraft."
}
